{
  "schemaVersion": "1.0",
  "command": "unknown",
  "requestedCommand": "bogus",
  "ok": false,
  "workspace": null,
  "work": null,
  "result": null,
  "diagnostics": [
    {
      "code": "DIAG_COMMAND_UNKNOWN",
      "severity": "error",
      "message": "Unknown command",
      "source": {"kind": "command"},
      "retryable": false
    }
  ],
  "nextActions": [],
  "exitCode": 2
}
